frame.time,ip.src,ip.dst,eth.src,eth.dst,tcp.port,udp.port,_ws.col.Info,data.text
"Nov 17, 2024 15:23:31.341575000 IST","151.101.38.172","172.20.10.4","aa:ab:b5:01:10:64","c0:35:32:26:48:bb","80,51749",,"80 → 51749 [ACK] Seq=1 Ack=1 Win=280 Len=1400",
"Nov 17, 2024 15:23:31.381243000 IST","172.20.10.4","151.101.38.172","c0:35:32:26:48:bb","aa:ab:b5:01:10:64","51749,80",,"51749 → 80 [ACK] Seq=1 Ack=1401 Win=514 Len=0",
"Nov 17, 2024 15:23:31.619078000 IST","151.101.38.172","172.20.10.4","aa:ab:b5:01:10:64","c0:35:32:26:48:bb","80,51749",,"80 → 51749 [ACK] Seq=1401 Ack=1 Win=280 Len=1400",
"Nov 17, 2024 15:23:31.658881000 IST","172.20.10.4","151.101.38.172","c0:35:32:26:48:bb","aa:ab:b5:01:10:64","51749,80",,"51749 → 80 [ACK] Seq=1 Ack=2801 Win=514 Len=0",
"Nov 17, 2024 15:23:31.662845000 IST","151.101.38.172","172.20.10.4","aa:ab:b5:01:10:64","c0:35:32:26:48:bb","80,51749",,"80 → 51749 [ACK] Seq=2801 Ack=1 Win=280 Len=1400",
"Nov 17, 2024 15:23:31.703902000 IST","172.20.10.4","151.101.38.172","c0:35:32:26:48:bb","aa:ab:b5:01:10:64","51749,80",,"51749 → 80 [ACK] Seq=1 Ack=4201 Win=514 Len=0",
"Nov 17, 2024 15:23:31.884409000 IST","151.101.38.172","172.20.10.4","aa:ab:b5:01:10:64","c0:35:32:26:48:bb","80,51749",,"80 → 51749 [ACK] Seq=4201 Ack=1 Win=280 Len=1400",
"Nov 17, 2024 15:23:31.921558000 IST","151.101.38.172","172.20.10.4","aa:ab:b5:01:10:64","c0:35:32:26:48:bb","80,51749",,"80 → 51749 [ACK] Seq=5601 Ack=1 Win=280 Len=1400",
"Nov 17, 2024 15:23:31.921668000 IST","172.20.10.4","151.101.38.172","c0:35:32:26:48:bb","aa:ab:b5:01:10:64","51749,80",,"51749 → 80 [ACK] Seq=1 Ack=7001 Win=514 Len=0",
"Nov 17, 2024 15:23:32.080617000 IST",,,"c0:35:32:26:48:bb","aa:ab:b5:01:10:64",,,"Neighbor Solicitation for fe80::a8ab:b5ff:fe01:1064 from c0:35:32:26:48:bb",
"Nov 17, 2024 15:23:32.087792000 IST",,,"aa:ab:b5:01:10:64","c0:35:32:26:48:bb",,,"Neighbor Advertisement fe80::a8ab:b5ff:fe01:1064 (rtr, sol)",
"Nov 17, 2024 15:23:32.142383000 IST","151.101.38.172","172.20.10.4","aa:ab:b5:01:10:64","c0:35:32:26:48:bb","80,51749",,"[TCP Previous segment not captured] 80 → 51749 [ACK] Seq=8401 Ack=1 Win=280 Len=1400",
"Nov 17, 2024 15:23:32.142452000 IST","172.20.10.4","151.101.38.172","c0:35:32:26:48:bb","aa:ab:b5:01:10:64","51749,80",,"[TCP Dup ACK 9#1] 51749 → 80 [ACK] Seq=1 Ack=7001 Win=514 Len=0 SLE=8401 SRE=9801",
"Nov 17, 2024 15:23:32.384559000 IST","151.101.38.172","172.20.10.4","aa:ab:b5:01:10:64","c0:35:32:26:48:bb","80,51749",,"[TCP Retransmission] 80 → 51749 [ACK] Seq=7001 Ack=1 Win=280 Len=1400",
"Nov 17, 2024 15:23:32.384654000 IST","172.20.10.4","151.101.38.172","c0:35:32:26:48:bb","aa:ab:b5:01:10:64","51749,80",,"51749 → 80 [ACK] Seq=1 Ack=9801 Win=514 Len=0",
"Nov 17, 2024 15:23:32.506004000 IST",,,"aa:ab:b5:01:10:64","c0:35:32:26:48:bb",,,"Neighbor Solicitation for 2401:4900:5ac6:a527:93a:1306:8b11:b908 from aa:ab:b5:01:10:64",
"Nov 17, 2024 15:23:32.506085000 IST",,,"c0:35:32:26:48:bb","aa:ab:b5:01:10:64",,,"Neighbor Advertisement 2401:4900:5ac6:a527:93a:1306:8b11:b908 (sol, ovr) is at c0:35:32:26:48:bb",
"Nov 17, 2024 15:23:32.607343000 IST",,,"c0:35:32:26:48:bb","aa:ab:b5:01:10:64","51324,5938",,"51324 → 5938 [PSH, ACK] Seq=1 Ack=1 Win=511 Len=24",
"Nov 17, 2024 15:23:32.625865000 IST","151.101.38.172","172.20.10.4","aa:ab:b5:01:10:64","c0:35:32:26:48:bb","80,51749",,"80 → 51749 [ACK] Seq=9801 Ack=1 Win=280 Len=1400",
"Nov 17, 2024 15:23:32.666532000 IST","172.20.10.4","151.101.38.172","c0:35:32:26:48:bb","aa:ab:b5:01:10:64","51749,80",,"51749 → 80 [ACK] Seq=1 Ack=11201 Win=514 Len=0",
"Nov 17, 2024 15:23:32.760650000 IST",,,"aa:ab:b5:01:10:64","c0:35:32:26:48:bb","5938,51324",,"5938 → 51324 [ACK] Seq=1 Ack=25 Win=1395 Len=0",
"Nov 17, 2024 15:23:32.893524000 IST","151.101.38.172","172.20.10.4","aa:ab:b5:01:10:64","c0:35:32:26:48:bb","80,51749",,"80 → 51749 [ACK] Seq=11201 Ack=1 Win=280 Len=1400",
"Nov 17, 2024 15:23:32.933243000 IST","172.20.10.4","151.101.38.172","c0:35:32:26:48:bb","aa:ab:b5:01:10:64","51749,80",,"51749 → 80 [ACK] Seq=1 Ack=12601 Win=514 Len=0",
"Nov 17, 2024 15:23:32.948753000 IST","151.101.38.172","172.20.10.4","aa:ab:b5:01:10:64","c0:35:32:26:48:bb","80,51749",,"80 → 51749 [ACK] Seq=12601 Ack=1 Win=280 Len=1400",
"Nov 17, 2024 15:23:32.989293000 IST","172.20.10.4","151.101.38.172","c0:35:32:26:48:bb","aa:ab:b5:01:10:64","51749,80",,"51749 → 80 [ACK] Seq=1 Ack=14001 Win=514 Len=0",
"Nov 17, 2024 15:23:33.177179000 IST","151.101.38.172","172.20.10.4","aa:ab:b5:01:10:64","c0:35:32:26:48:bb","80,51749",,"80 → 51749 [ACK] Seq=14001 Ack=1 Win=280 Len=1400",
"Nov 17, 2024 15:23:33.217767000 IST","172.20.10.4","151.101.38.172","c0:35:32:26:48:bb","aa:ab:b5:01:10:64","51749,80",,"51749 → 80 [ACK] Seq=1 Ack=15401 Win=514 Len=0",
"Nov 17, 2024 15:23:33.275407000 IST","151.101.38.172","172.20.10.4","aa:ab:b5:01:10:64","c0:35:32:26:48:bb","80,51749",,"[TCP Previous segment not captured] 80 → 51749 [ACK] Seq=16801 Ack=1 Win=280 Len=1400",
"Nov 17, 2024 15:23:33.275490000 IST","172.20.10.4","151.101.38.172","c0:35:32:26:48:bb","aa:ab:b5:01:10:64","51749,80",,"[TCP Dup ACK 27#1] 51749 → 80 [ACK] Seq=1 Ack=15401 Win=514 Len=0 SLE=16801 SRE=18201",
"Nov 17, 2024 15:23:33.462856000 IST","151.101.38.172","172.20.10.4","aa:ab:b5:01:10:64","c0:35:32:26:48:bb","80,51749",,"80 → 51749 [ACK] Seq=18201 Ack=1 Win=280 Len=1400",
"Nov 17, 2024 15:23:33.462934000 IST","172.20.10.4","151.101.38.172","c0:35:32:26:48:bb","aa:ab:b5:01:10:64","51749,80",,"[TCP Dup ACK 27#2] 51749 → 80 [ACK] Seq=1 Ack=15401 Win=514 Len=0 SLE=16801 SRE=19601",
"Nov 17, 2024 15:23:33.698265000 IST","151.101.38.172","172.20.10.4","aa:ab:b5:01:10:64","c0:35:32:26:48:bb","80,51749",,"80 → 51749 [ACK] Seq=19601 Ack=1 Win=280 Len=1400",
"Nov 17, 2024 15:23:33.698333000 IST","172.20.10.4","151.101.38.172","c0:35:32:26:48:bb","aa:ab:b5:01:10:64","51749,80",,"[TCP Dup ACK 27#3] 51749 → 80 [ACK] Seq=1 Ack=15401 Win=514 Len=0 SLE=16801 SRE=21001",
"Nov 17, 2024 15:23:33.938844000 IST","151.101.38.172","172.20.10.4","aa:ab:b5:01:10:64","c0:35:32:26:48:bb","80,51749",,"[TCP Retransmission] 80 → 51749 [PSH, ACK] Seq=15401 Ack=1 Win=280 Len=1400",
"Nov 17, 2024 15:23:33.938946000 IST","172.20.10.4","151.101.38.172","c0:35:32:26:48:bb","aa:ab:b5:01:10:64","51749,80",,"51749 → 80 [ACK] Seq=1 Ack=21001 Win=514 Len=0",
"Nov 17, 2024 15:23:34.053644000 IST","172.20.10.4","172.20.10.1","c0:35:32:26:48:bb","aa:ab:b5:01:10:64",,"60507,53","Standard query 0xd1af AAAA www.bing.com",
"Nov 17, 2024 15:23:34.053936000 IST","172.20.10.4","172.20.10.1","c0:35:32:26:48:bb","aa:ab:b5:01:10:64",,"60508,53","Standard query 0x26a1 A www.bing.com",
"Nov 17, 2024 15:23:34.054100000 IST","172.20.10.4","172.20.10.1","c0:35:32:26:48:bb","aa:ab:b5:01:10:64",,"60509,53","Standard query 0x50fc HTTPS www.bing.com",
"Nov 17, 2024 15:23:34.094583000 IST","172.20.10.1","172.20.10.4","aa:ab:b5:01:10:64","c0:35:32:26:48:bb",,"53,60507","Standard query response 0xd1af AAAA www.bing.com CNAME www-www.bing.com.trafficmanager.net CNAME www.bing.com.edgekey.net CNAME e86303.dscx.akamaiedge.net AAAA 2600:1417:56::174c:9d1a AAAA 2600:1417:56::174c:9d09",
"Nov 17, 2024 15:23:34.094583000 IST","172.20.10.1","172.20.10.4","aa:ab:b5:01:10:64","c0:35:32:26:48:bb",,"53,60509","Standard query response 0x50fc HTTPS www.bing.com CNAME www-www.bing.com.trafficmanager.net CNAME www.bing.com.edgekey.net CNAME e86303.dscx.akamaiedge.net SOA n0dscx.akamaiedge.net",
"Nov 17, 2024 15:23:34.101171000 IST","172.20.10.1","172.20.10.4","aa:ab:b5:01:10:64","c0:35:32:26:48:bb",,"53,60508","Standard query response 0x26a1 A www.bing.com CNAME www-www.bing.com.trafficmanager.net CNAME www.bing.com.edgekey.net CNAME e86303.dscx.akamaiedge.net A 96.17.168.42 A 23.200.239.225 A 23.200.239.216",
"Nov 17, 2024 15:23:34.107449000 IST",,,"c0:35:32:26:48:bb","aa:ab:b5:01:10:64","51951,443",,"51951 → 443 [SYN] Seq=0 Win=65330 Len=0 MSS=1390 WS=256 SACK_PERM=1",
"Nov 17, 2024 15:23:34.151236000 IST",,,"aa:ab:b5:01:10:64","c0:35:32:26:48:bb","443,51951",,"443 → 51951 [SYN, ACK] Seq=0 Ack=1 Win=64800 Len=0 MSS=1380 SACK_PERM=1 WS=128",
"Nov 17, 2024 15:23:34.151384000 IST",,,"c0:35:32:26:48:bb","aa:ab:b5:01:10:64","51951,443",,"51951 → 443 [ACK] Seq=1 Ack=1 Win=131072 Len=0",
"Nov 17, 2024 15:23:34.155554000 IST",,,"c0:35:32:26:48:bb","aa:ab:b5:01:10:64","51951,443",,"[TCP segment of a reassembled PDU]",
"Nov 17, 2024 15:23:34.155554000 IST",,,"c0:35:32:26:48:bb","aa:ab:b5:01:10:64","51951,443",,"51951 → 443 [PSH, ACK] Seq=1381 Ack=1 Win=131072 Len=60 [TCP segment of a reassembled PDU]",
"Nov 17, 2024 15:23:34.155716000 IST",,,"c0:35:32:26:48:bb","aa:ab:b5:01:10:64","51951,443",,"Client Hello",
"Nov 17, 2024 15:23:34.167232000 IST","151.101.38.172","172.20.10.4","aa:ab:b5:01:10:64","c0:35:32:26:48:bb","80,51749",,"80 → 51749 [ACK] Seq=21001 Ack=1 Win=280 Len=1400",
"Nov 17, 2024 15:23:34.206214000 IST",,,"aa:ab:b5:01:10:64","c0:35:32:26:48:bb","443,51951",,"443 → 51951 [ACK] Seq=1 Ack=1381 Win=64128 Len=0",
"Nov 17, 2024 15:23:34.206214000 IST",,,"aa:ab:b5:01:10:64","c0:35:32:26:48:bb","443,51951",,"[TCP Dup ACK 49#1] 443 → 51951 [ACK] Seq=1 Ack=1381 Win=64128 Len=0 SLE=1441 SRE=1723",
"Nov 17, 2024 15:23:34.207180000 IST","172.20.10.4","151.101.38.172","c0:35:32:26:48:bb","aa:ab:b5:01:10:64","51749,80",,"51749 → 80 [ACK] Seq=1 Ack=22401 Win=514 Len=0",
"Nov 17, 2024 15:23:34.207899000 IST",,,"aa:ab:b5:01:10:64","c0:35:32:26:48:bb","443,51951",,"443 → 51951 [ACK] Seq=1 Ack=1723 Win=63872 Len=0",
"Nov 17, 2024 15:23:34.207899000 IST",,,"aa:ab:b5:01:10:64","c0:35:32:26:48:bb","443,51951",,"Server Hello, Change Cipher Spec, Application Data",
"Nov 17, 2024 15:23:34.248031000 IST",,,"c0:35:32:26:48:bb","aa:ab:b5:01:10:64","51951,443",,"51951 → 443 [ACK] Seq=1723 Ack=1381 Win=131072 Len=0",
"Nov 17, 2024 15:23:34.409411000 IST",,,"aa:ab:b5:01:10:64","c0:35:32:26:48:bb","443,51951",,"[TCP Previous segment not captured] 443 → 51951 [PSH, ACK] Seq=2761 Ack=1723 Win=64128 Len=1274 [TCP segment of a reassembled PDU], Application Data, Application Data",
"Nov 17, 2024 15:23:34.409502000 IST",,,"c0:35:32:26:48:bb","aa:ab:b5:01:10:64","51951,443",,"[TCP Dup ACK 54#1] 51951 → 443 [ACK] Seq=1723 Ack=1381 Win=131072 Len=0 SLE=2761 SRE=4035",
"Nov 17, 2024 15:23:34.707455000 IST",,,"aa:ab:b5:01:10:64","c0:35:32:26:48:bb","443,51951",,"[TCP Retransmission] 443 → 51951 [ACK] Seq=1381 Ack=1723 Win=64128 Len=1380",
"Nov 17, 2024 15:23:34.707561000 IST",,,"c0:35:32:26:48:bb","aa:ab:b5:01:10:64","51951,443",,"51951 → 443 [ACK] Seq=1723 Ack=4035 Win=131072 Len=0",
"Nov 17, 2024 15:23:34.713429000 IST",,,"c0:35:32:26:48:bb","aa:ab:b5:01:10:64","51951,443",,"Change Cipher Spec, Application Data",
"Nov 17, 2024 15:23:34.765108000 IST",,,"aa:ab:b5:01:10:64","c0:35:32:26:48:bb","443,51951",,"443 → 51951 [ACK] Seq=4035 Ack=1803 Win=64128 Len=0",
"Nov 17, 2024 15:23:34.766659000 IST",,,"aa:ab:b5:01:10:64","c0:35:32:26:48:bb","443,51951",,"Application Data",
"Nov 17, 2024 15:23:34.766659000 IST",,,"aa:ab:b5:01:10:64","c0:35:32:26:48:bb","443,51951",,"Application Data",
"Nov 17, 2024 15:23:34.766706000 IST",,,"c0:35:32:26:48:bb","aa:ab:b5:01:10:64","51951,443",,"51951 → 443 [ACK] Seq=1803 Ack=4609 Win=130304 Len=0",
"Nov 17, 2024 15:23:35.287843000 IST",,,"aa:ab:b5:01:10:64","c0:35:32:26:48:bb",,,"Who has 172.20.10.4? Tell 172.20.10.1",
"Nov 17, 2024 15:23:35.287843000 IST","151.101.38.172","172.20.10.4","aa:ab:b5:01:10:64","c0:35:32:26:48:bb","80,51749",,"80 → 51749 [ACK] Seq=22401 Ack=1 Win=280 Len=1400",
"Nov 17, 2024 15:23:35.287879000 IST",,,"c0:35:32:26:48:bb","aa:ab:b5:01:10:64",,,"172.20.10.4 is at c0:35:32:26:48:bb",
"Nov 17, 2024 15:23:35.328216000 IST","172.20.10.4","151.101.38.172","c0:35:32:26:48:bb","aa:ab:b5:01:10:64","51749,80",,"51749 → 80 [ACK] Seq=1 Ack=23801 Win=514 Len=0",
"Nov 17, 2024 15:23:35.586049000 IST","151.101.38.172","172.20.10.4","aa:ab:b5:01:10:64","c0:35:32:26:48:bb","80,51749",,"[TCP Previous segment not captured] 80 → 51749 [ACK] Seq=28001 Ack=1 Win=280 Len=1400",
"Nov 17, 2024 15:23:35.586124000 IST","172.20.10.4","151.101.38.172","c0:35:32:26:48:bb","aa:ab:b5:01:10:64","51749,80",,"[TCP Dup ACK 67#1] 51749 → 80 [ACK] Seq=1 Ack=23801 Win=514 Len=0 SLE=28001 SRE=29401",
"Nov 17, 2024 15:23:35.588645000 IST","151.101.38.172","172.20.10.4","aa:ab:b5:01:10:64","c0:35:32:26:48:bb","80,51749",,"80 → 51749 [ACK] Seq=29401 Ack=1 Win=280 Len=1400",
"Nov 17, 2024 15:23:35.588701000 IST","172.20.10.4","151.101.38.172","c0:35:32:26:48:bb","aa:ab:b5:01:10:64","51749,80",,"[TCP Dup ACK 67#2] 51749 → 80 [ACK] Seq=1 Ack=23801 Win=514 Len=0 SLE=28001 SRE=30801",
"Nov 17, 2024 15:23:35.832128000 IST","151.101.38.172","172.20.10.4","aa:ab:b5:01:10:64","c0:35:32:26:48:bb","80,51749",,"[TCP Retransmission] 80 → 51749 [ACK] Seq=23801 Ack=1 Win=280 Len=1400",
"Nov 17, 2024 15:23:35.832219000 IST","172.20.10.4","151.101.38.172","c0:35:32:26:48:bb","aa:ab:b5:01:10:64","51749,80",,"51749 → 80 [ACK] Seq=1 Ack=25201 Win=514 Len=0 SLE=28001 SRE=30801",
"Nov 17, 2024 15:23:35.844113000 IST","151.101.38.172","172.20.10.4","aa:ab:b5:01:10:64","c0:35:32:26:48:bb","80,51749",,"[TCP Retransmission] 80 → 51749 [ACK] Seq=25201 Ack=1 Win=280 Len=1400",
"Nov 17, 2024 15:23:35.844196000 IST","172.20.10.4","151.101.38.172","c0:35:32:26:48:bb","aa:ab:b5:01:10:64","51749,80",,"51749 → 80 [ACK] Seq=1 Ack=26601 Win=514 Len=0 SLE=28001 SRE=30801",
"Nov 17, 2024 15:23:36.055575000 IST","151.101.38.172","172.20.10.4","aa:ab:b5:01:10:64","c0:35:32:26:48:bb","80,51749",,"[TCP Retransmission] 80 → 51749 [ACK] Seq=26601 Ack=1 Win=280 Len=1400",
"Nov 17, 2024 15:23:36.055694000 IST","172.20.10.4","151.101.38.172","c0:35:32:26:48:bb","aa:ab:b5:01:10:64","51749,80",,"51749 → 80 [ACK] Seq=1 Ack=30801 Win=514 Len=0",
"Nov 17, 2024 15:23:36.080212000 IST","151.101.38.172","172.20.10.4","aa:ab:b5:01:10:64","c0:35:32:26:48:bb","80,51749",,"80 → 51749 [ACK] Seq=30801 Ack=1 Win=280 Len=1400",
"Nov 17, 2024 15:23:36.120728000 IST","172.20.10.4","151.101.38.172","c0:35:32:26:48:bb","aa:ab:b5:01:10:64","51749,80",,"51749 → 80 [ACK] Seq=1 Ack=32201 Win=514 Len=0",
"Nov 17, 2024 15:23:36.286648000 IST","151.101.38.172","172.20.10.4","aa:ab:b5:01:10:64","c0:35:32:26:48:bb","80,51749",,"80 → 51749 [ACK] Seq=32201 Ack=1 Win=280 Len=1400",
"Nov 17, 2024 15:23:36.327237000 IST","172.20.10.4","151.101.38.172","c0:35:32:26:48:bb","aa:ab:b5:01:10:64","51749,80",,"51749 → 80 [ACK] Seq=1 Ack=33601 Win=514 Len=0",
"Nov 17, 2024 15:23:36.343702000 IST","151.101.38.172","172.20.10.4","aa:ab:b5:01:10:64","c0:35:32:26:48:bb","80,51749",,"80 → 51749 [ACK] Seq=33601 Ack=1 Win=280 Len=1400",
"Nov 17, 2024 15:23:36.384149000 IST","172.20.10.4","151.101.38.172","c0:35:32:26:48:bb","aa:ab:b5:01:10:64","51749,80",,"51749 → 80 [ACK] Seq=1 Ack=35001 Win=514 Len=0",
"Nov 17, 2024 15:23:36.522448000 IST","172.20.10.2","172.20.10.4","3c:95:09:f2:ef:17","c0:35:32:26:48:bb","4444,51480",,"4444 → 51480 [PSH, ACK] Seq=1 Ack=1 Win=14182 Len=112",
"Nov 17, 2024 15:23:36.542537000 IST","151.101.38.172","172.20.10.4","aa:ab:b5:01:10:64","c0:35:32:26:48:bb","80,51749",,"[TCP Previous segment not captured] 80 → 51749 [ACK] Seq=36401 Ack=1 Win=280 Len=1400",
"Nov 17, 2024 15:23:36.542615000 IST","172.20.10.4","151.101.38.172","c0:35:32:26:48:bb","aa:ab:b5:01:10:64","51749,80",,"[TCP Dup ACK 83#1] 51749 → 80 [ACK] Seq=1 Ack=35001 Win=514 Len=0 SLE=36401 SRE=37801",
"Nov 17, 2024 15:23:36.562488000 IST","172.20.10.4","172.20.10.2","c0:35:32:26:48:bb","3c:95:09:f2:ef:17","51480,4444",,"51480 → 4444 [ACK] Seq=1 Ack=113 Win=2052 Len=0",
"Nov 17, 2024 15:23:36.580208000 IST","172.20.10.4","172.20.10.2","c0:35:32:26:48:bb","3c:95:09:f2:ef:17","51480,4444",,"51480 → 4444 [PSH, ACK] Seq=1 Ack=113 Win=2052 Len=368",
"Nov 17, 2024 15:23:36.598713000 IST","172.20.10.2","172.20.10.4","3c:95:09:f2:ef:17","c0:35:32:26:48:bb","4444,51480",,"4444 → 51480 [ACK] Seq=113 Ack=369 Win=14182 Len=0",
"Nov 17, 2024 15:23:36.759937000 IST","151.101.38.172","172.20.10.4","aa:ab:b5:01:10:64","c0:35:32:26:48:bb","80,51749",,"[TCP Retransmission] 80 → 51749 [ACK] Seq=35001 Ack=1 Win=280 Len=1400",
"Nov 17, 2024 15:23:36.760007000 IST","172.20.10.4","151.101.38.172","c0:35:32:26:48:bb","aa:ab:b5:01:10:64","51749,80",,"51749 → 80 [ACK] Seq=1 Ack=37801 Win=514 Len=0",
"Nov 17, 2024 15:23:36.834023000 IST","172.20.10.2","172.20.10.4","3c:95:09:f2:ef:17","c0:35:32:26:48:bb","4444,51480",,"4444 → 51480 [ACK] Seq=113 Ack=369 Win=14182 Len=1460",
"Nov 17, 2024 15:23:36.834023000 IST","172.20.10.2","172.20.10.4","3c:95:09:f2:ef:17","c0:35:32:26:48:bb","4444,51480",,"4444 → 51480 [ACK] Seq=1573 Ack=369 Win=14182 Len=1460",
"Nov 17, 2024 15:23:36.834023000 IST","172.20.10.2","172.20.10.4","3c:95:09:f2:ef:17","c0:35:32:26:48:bb","4444,51480",,"4444 → 51480 [ACK] Seq=3033 Ack=369 Win=14182 Len=1460",
"Nov 17, 2024 15:23:36.834023000 IST","172.20.10.2","172.20.10.4","3c:95:09:f2:ef:17","c0:35:32:26:48:bb","4444,51480",,"4444 → 51480 [PSH, ACK] Seq=4493 Ack=369 Win=14182 Len=1460",
"Nov 17, 2024 15:23:36.834023000 IST","172.20.10.2","172.20.10.4","3c:95:09:f2:ef:17","c0:35:32:26:48:bb","4444,51480",,"4444 → 51480 [ACK] Seq=5953 Ack=369 Win=14182 Len=1460",
"Nov 17, 2024 15:23:36.834023000 IST","172.20.10.2","172.20.10.4","3c:95:09:f2:ef:17","c0:35:32:26:48:bb","4444,51480",,"4444 → 51480 [ACK] Seq=7413 Ack=369 Win=14182 Len=1460",
"Nov 17, 2024 15:23:36.834139000 IST","172.20.10.4","172.20.10.2","c0:35:32:26:48:bb","3c:95:09:f2:ef:17","51480,4444",,"51480 → 4444 [ACK] Seq=369 Ack=8873 Win=2053 Len=0",
"Nov 17, 2024 15:23:36.835643000 IST","172.20.10.2","172.20.10.4","3c:95:09:f2:ef:17","c0:35:32:26:48:bb","4444,51480",,"4444 → 51480 [ACK] Seq=8873 Ack=369 Win=14182 Len=1460",
"Nov 17, 2024 15:23:36.835643000 IST","172.20.10.2","172.20.10.4","3c:95:09:f2:ef:17","c0:35:32:26:48:bb","4444,51480",,"4444 → 51480 [PSH, ACK] Seq=10333 Ack=369 Win=14182 Len=1460",
"Nov 17, 2024 15:23:36.835643000 IST","172.20.10.2","172.20.10.4","3c:95:09:f2:ef:17","c0:35:32:26:48:bb","4444,51480",,"4444 → 51480 [ACK] Seq=11793 Ack=369 Win=14182 Len=1460",
"Nov 17, 2024 15:23:36.835643000 IST","172.20.10.2","172.20.10.4","3c:95:09:f2:ef:17","c0:35:32:26:48:bb","4444,51480",,"4444 → 51480 [PSH, ACK] Seq=13253 Ack=369 Win=14182 Len=1460",
"Nov 17, 2024 15:23:36.835764000 IST","172.20.10.4","172.20.10.2","c0:35:32:26:48:bb","3c:95:09:f2:ef:17","51480,4444",,"51480 → 4444 [ACK] Seq=369 Ack=14713 Win=2053 Len=0",
"Nov 17, 2024 15:23:36.952853000 IST","172.20.10.2","172.20.10.4","3c:95:09:f2:ef:17","c0:35:32:26:48:bb","4444,51480",,"4444 → 51480 [ACK] Seq=14713 Ack=369 Win=14182 Len=1460",
"Nov 17, 2024 15:23:36.952853000 IST","172.20.10.2","172.20.10.4","3c:95:09:f2:ef:17","c0:35:32:26:48:bb","4444,51480",,"4444 → 51480 [ACK] Seq=16173 Ack=369 Win=14182 Len=1460",
"Nov 17, 2024 15:23:36.952853000 IST","172.20.10.2","172.20.10.4","3c:95:09:f2:ef:17","c0:35:32:26:48:bb","4444,51480",,"4444 → 51480 [ACK] Seq=17633 Ack=369 Win=14182 Len=1460",
"Nov 17, 2024 15:23:36.952853000 IST","172.20.10.2","172.20.10.4","3c:95:09:f2:ef:17","c0:35:32:26:48:bb","4444,51480",,"4444 → 51480 [ACK] Seq=19093 Ack=369 Win=14182 Len=1460",
"Nov 17, 2024 15:23:36.952853000 IST","172.20.10.2","172.20.10.4","3c:95:09:f2:ef:17","c0:35:32:26:48:bb","4444,51480",,"4444 → 51480 [ACK] Seq=20553 Ack=369 Win=14182 Len=1460",
"Nov 17, 2024 15:23:36.952853000 IST","172.20.10.2","172.20.10.4","3c:95:09:f2:ef:17","c0:35:32:26:48:bb","4444,51480",,"4444 → 51480 [ACK] Seq=22013 Ack=369 Win=14182 Len=1460",
"Nov 17, 2024 15:23:36.952981000 IST","172.20.10.4","172.20.10.2","c0:35:32:26:48:bb","3c:95:09:f2:ef:17","51480,4444",,"51480 → 4444 [ACK] Seq=369 Ack=23473 Win=2053 Len=0",
"Nov 17, 2024 15:23:36.953775000 IST","172.20.10.2","172.20.10.4","3c:95:09:f2:ef:17","c0:35:32:26:48:bb","4444,51480",,"4444 → 51480 [PSH, ACK] Seq=23473 Ack=369 Win=14182 Len=1460",
"Nov 17, 2024 15:23:36.955323000 IST","172.20.10.2","172.20.10.4","3c:95:09:f2:ef:17","c0:35:32:26:48:bb","4444,51480",,"4444 → 51480 [ACK] Seq=24933 Ack=369 Win=14182 Len=1460",
"Nov 17, 2024 15:23:36.955323000 IST","172.20.10.2","172.20.10.4","3c:95:09:f2:ef:17","c0:35:32:26:48:bb","4444,51480",,"4444 → 51480 [ACK] Seq=26393 Ack=369 Win=14182 Len=1460",
"Nov 17, 2024 15:23:36.955323000 IST","172.20.10.2","172.20.10.4","3c:95:09:f2:ef:17","c0:35:32:26:48:bb","4444,51480",,"4444 → 51480 [ACK] Seq=27853 Ack=369 Win=14182 Len=1460",
"Nov 17, 2024 15:23:36.955323000 IST","172.20.10.2","172.20.10.4","3c:95:09:f2:ef:17","c0:35:32:26:48:bb","4444,51480",,"4444 → 51480 [ACK] Seq=29313 Ack=369 Win=14182 Len=1460",
"Nov 17, 2024 15:23:36.955323000 IST","172.20.10.2","172.20.10.4","3c:95:09:f2:ef:17","c0:35:32:26:48:bb","4444,51480",,"4444 → 51480 [PSH, ACK] Seq=30773 Ack=369 Win=14182 Len=1460",
"Nov 17, 2024 15:23:36.955414000 IST","172.20.10.4","172.20.10.2","c0:35:32:26:48:bb","3c:95:09:f2:ef:17","51480,4444",,"51480 → 4444 [ACK] Seq=369 Ack=32233 Win=2053 Len=0",
"Nov 17, 2024 15:23:36.956823000 IST","172.20.10.2","172.20.10.4","3c:95:09:f2:ef:17","c0:35:32:26:48:bb","4444,51480",,"4444 → 51480 [ACK] Seq=32233 Ack=369 Win=14182 Len=1460",
"Nov 17, 2024 15:23:36.956823000 IST","172.20.10.2","172.20.10.4","3c:95:09:f2:ef:17","c0:35:32:26:48:bb","4444,51480",,"4444 → 51480 [ACK] Seq=33693 Ack=369 Win=14182 Len=1460",
"Nov 17, 2024 15:23:36.956823000 IST","172.20.10.2","172.20.10.4","3c:95:09:f2:ef:17","c0:35:32:26:48:bb","4444,51480",,"4444 → 51480 [ACK] Seq=35153 Ack=369 Win=14182 Len=1460",
"Nov 17, 2024 15:23:36.956823000 IST","172.20.10.2","172.20.10.4","3c:95:09:f2:ef:17","c0:35:32:26:48:bb","4444,51480",,"4444 → 51480 [ACK] Seq=36613 Ack=369 Win=14182 Len=1460",
"Nov 17, 2024 15:23:36.956823000 IST","172.20.10.2","172.20.10.4","3c:95:09:f2:ef:17","c0:35:32:26:48:bb","4444,51480",,"4444 → 51480 [PSH, ACK] Seq=38073 Ack=369 Win=14182 Len=1460",
"Nov 17, 2024 15:23:36.956937000 IST","172.20.10.4","172.20.10.2","c0:35:32:26:48:bb","3c:95:09:f2:ef:17","51480,4444",,"51480 → 4444 [ACK] Seq=369 Ack=39533 Win=2053 Len=0",
"Nov 17, 2024 15:23:36.961346000 IST","172.20.10.2","172.20.10.4","3c:95:09:f2:ef:17","c0:35:32:26:48:bb","4444,51480",,"4444 → 51480 [ACK] Seq=39533 Ack=369 Win=14182 Len=1460",
"Nov 17, 2024 15:23:36.961346000 IST","172.20.10.2","172.20.10.4","3c:95:09:f2:ef:17","c0:35:32:26:48:bb","4444,51480",,"4444 → 51480 [ACK] Seq=40993 Ack=369 Win=14182 Len=1460",
"Nov 17, 2024 15:23:36.961346000 IST","172.20.10.2","172.20.10.4","3c:95:09:f2:ef:17","c0:35:32:26:48:bb","4444,51480",,"4444 → 51480 [ACK] Seq=42453 Ack=369 Win=14182 Len=1460",
"Nov 17, 2024 15:23:36.961424000 IST","172.20.10.4","172.20.10.2","c0:35:32:26:48:bb","3c:95:09:f2:ef:17","51480,4444",,"51480 → 4444 [ACK] Seq=369 Ack=43913 Win=2053 Len=0",
"Nov 17, 2024 15:23:36.963304000 IST","172.20.10.2","172.20.10.4","3c:95:09:f2:ef:17","c0:35:32:26:48:bb","4444,51480",,"4444 → 51480 [ACK] Seq=43913 Ack=369 Win=14182 Len=1460",
"Nov 17, 2024 15:23:36.963304000 IST","172.20.10.2","172.20.10.4","3c:95:09:f2:ef:17","c0:35:32:26:48:bb","4444,51480",,"4444 → 51480 [PSH, ACK] Seq=45373 Ack=369 Win=14182 Len=1460",
"Nov 17, 2024 15:23:36.963402000 IST","172.20.10.4","172.20.10.2","c0:35:32:26:48:bb","3c:95:09:f2:ef:17","51480,4444",,"51480 → 4444 [ACK] Seq=369 Ack=46833 Win=2053 Len=0",
"Nov 17, 2024 15:23:36.969697000 IST","172.20.10.2","172.20.10.4","3c:95:09:f2:ef:17","c0:35:32:26:48:bb","4444,51480",,"4444 → 51480 [ACK] Seq=46833 Ack=369 Win=14182 Len=1460",
"Nov 17, 2024 15:23:36.969697000 IST","172.20.10.2","172.20.10.4","3c:95:09:f2:ef:17","c0:35:32:26:48:bb","4444,51480",,"4444 → 51480 [ACK] Seq=48293 Ack=369 Win=14182 Len=1460",
"Nov 17, 2024 15:23:36.969697000 IST","172.20.10.2","172.20.10.4","3c:95:09:f2:ef:17","c0:35:32:26:48:bb","4444,51480",,"4444 → 51480 [ACK] Seq=49753 Ack=369 Win=14182 Len=1460",
"Nov 17, 2024 15:23:36.969697000 IST","172.20.10.2","172.20.10.4","3c:95:09:f2:ef:17","c0:35:32:26:48:bb","4444,51480",,"4444 → 51480 [ACK] Seq=51213 Ack=369 Win=14182 Len=1460",
"Nov 17, 2024 15:23:36.969697000 IST","172.20.10.2","172.20.10.4","3c:95:09:f2:ef:17","c0:35:32:26:48:bb","4444,51480",,"4444 → 51480 [PSH, ACK] Seq=52673 Ack=369 Win=14182 Len=1460",
"Nov 17, 2024 15:23:36.969697000 IST","172.20.10.2","172.20.10.4","3c:95:09:f2:ef:17","c0:35:32:26:48:bb","4444,51480",,"4444 → 51480 [ACK] Seq=54133 Ack=369 Win=14182 Len=1460",
"Nov 17, 2024 15:23:36.969697000 IST","172.20.10.2","172.20.10.4","3c:95:09:f2:ef:17","c0:35:32:26:48:bb","4444,51480",,"4444 → 51480 [ACK] Seq=55593 Ack=369 Win=14182 Len=1460",
"Nov 17, 2024 15:23:36.969697000 IST","172.20.10.2","172.20.10.4","3c:95:09:f2:ef:17","c0:35:32:26:48:bb","4444,51480",,"4444 → 51480 [ACK] Seq=57053 Ack=369 Win=14182 Len=1460",
"Nov 17, 2024 15:23:36.969697000 IST","172.20.10.2","172.20.10.4","3c:95:09:f2:ef:17","c0:35:32:26:48:bb","4444,51480",,"4444 → 51480 [ACK] Seq=58513 Ack=369 Win=14182 Len=1460",
"Nov 17, 2024 15:23:36.969697000 IST","172.20.10.2","172.20.10.4","3c:95:09:f2:ef:17","c0:35:32:26:48:bb","4444,51480",,"4444 → 51480 [PSH, ACK] Seq=59973 Ack=369 Win=14182 Len=1460",
"Nov 17, 2024 15:23:36.969697000 IST","172.20.10.2","172.20.10.4","3c:95:09:f2:ef:17","c0:35:32:26:48:bb","4444,51480",,"4444 → 51480 [ACK] Seq=61433 Ack=369 Win=14182 Len=1460",
"Nov 17, 2024 15:23:36.969775000 IST","172.20.10.4","172.20.10.2","c0:35:32:26:48:bb","3c:95:09:f2:ef:17","51480,4444",,"51480 → 4444 [ACK] Seq=369 Ack=62893 Win=2053 Len=0",
"Nov 17, 2024 15:23:36.970413000 IST","172.20.10.2","172.20.10.4","3c:95:09:f2:ef:17","c0:35:32:26:48:bb","4444,51480",,"4444 → 51480 [ACK] Seq=62893 Ack=369 Win=14182 Len=1460",
"Nov 17, 2024 15:23:36.970413000 IST","172.20.10.2","172.20.10.4","3c:95:09:f2:ef:17","c0:35:32:26:48:bb","4444,51480",,"4444 → 51480 [ACK] Seq=64353 Ack=369 Win=14182 Len=1460",
"Nov 17, 2024 15:23:36.970442000 IST","172.20.10.4","172.20.10.2","c0:35:32:26:48:bb","3c:95:09:f2:ef:17","51480,4444",,"51480 → 4444 [ACK] Seq=369 Ack=65813 Win=2053 Len=0",
"Nov 17, 2024 15:23:36.974254000 IST","172.20.10.2","172.20.10.4","3c:95:09:f2:ef:17","c0:35:32:26:48:bb","4444,51480",,"4444 → 51480 [ACK] Seq=65813 Ack=369 Win=14182 Len=1460",
"Nov 17, 2024 15:23:36.974254000 IST","172.20.10.2","172.20.10.4","3c:95:09:f2:ef:17","c0:35:32:26:48:bb","4444,51480",,"4444 → 51480 [ACK] Seq=67273 Ack=369 Win=14182 Len=1460",
"Nov 17, 2024 15:23:36.974287000 IST","172.20.10.4","172.20.10.2","c0:35:32:26:48:bb","3c:95:09:f2:ef:17","51480,4444",,"51480 → 4444 [ACK] Seq=369 Ack=68733 Win=2053 Len=0",
"Nov 17, 2024 15:23:36.975913000 IST","172.20.10.2","172.20.10.4","3c:95:09:f2:ef:17","c0:35:32:26:48:bb","4444,51480",,"4444 → 51480 [ACK] Seq=68733 Ack=369 Win=14182 Len=1460",
"Nov 17, 2024 15:23:36.975913000 IST","172.20.10.2","172.20.10.4","3c:95:09:f2:ef:17","c0:35:32:26:48:bb","4444,51480",,"4444 → 51480 [PSH, ACK] Seq=70193 Ack=369 Win=14182 Len=1460",
"Nov 17, 2024 15:23:36.975913000 IST","172.20.10.2","172.20.10.4","3c:95:09:f2:ef:17","c0:35:32:26:48:bb","4444,51480",,"4444 → 51480 [ACK] Seq=71653 Ack=369 Win=14182 Len=1460",
"Nov 17, 2024 15:23:36.975913000 IST","172.20.10.2","172.20.10.4","3c:95:09:f2:ef:17","c0:35:32:26:48:bb","4444,51480",,"4444 → 51480 [ACK] Seq=73113 Ack=369 Win=14182 Len=1460",
"Nov 17, 2024 15:23:36.975913000 IST","172.20.10.2","172.20.10.4","3c:95:09:f2:ef:17","c0:35:32:26:48:bb","4444,51480",,"4444 → 51480 [ACK] Seq=74573 Ack=369 Win=14182 Len=1460",
"Nov 17, 2024 15:23:36.975913000 IST","172.20.10.2","172.20.10.4","3c:95:09:f2:ef:17","c0:35:32:26:48:bb","4444,51480",,"4444 → 51480 [ACK] Seq=76033 Ack=369 Win=14182 Len=1460",
"Nov 17, 2024 15:23:36.975913000 IST","172.20.10.2","172.20.10.4","3c:95:09:f2:ef:17","c0:35:32:26:48:bb","4444,51480",,"4444 → 51480 [PSH, ACK] Seq=77493 Ack=369 Win=14182 Len=1460",
"Nov 17, 2024 15:23:36.975913000 IST","172.20.10.2","172.20.10.4","3c:95:09:f2:ef:17","c0:35:32:26:48:bb","4444,51480",,"4444 → 51480 [ACK] Seq=78953 Ack=369 Win=14182 Len=1460",
"Nov 17, 2024 15:23:36.975913000 IST","172.20.10.2","172.20.10.4","3c:95:09:f2:ef:17","c0:35:32:26:48:bb","4444,51480",,"4444 → 51480 [ACK] Seq=80413 Ack=369 Win=14182 Len=1460",
"Nov 17, 2024 15:23:36.975913000 IST","172.20.10.2","172.20.10.4","3c:95:09:f2:ef:17","c0:35:32:26:48:bb","4444,51480",,"4444 → 51480 [ACK] Seq=81873 Ack=369 Win=14182 Len=1460",
"Nov 17, 2024 15:23:36.975913000 IST","172.20.10.2","172.20.10.4","3c:95:09:f2:ef:17","c0:35:32:26:48:bb","4444,51480",,"4444 → 51480 [ACK] Seq=83333 Ack=369 Win=14182 Len=1460",
"Nov 17, 2024 15:23:36.975913000 IST","172.20.10.2","172.20.10.4","3c:95:09:f2:ef:17","c0:35:32:26:48:bb","4444,51480",,"4444 → 51480 [ACK] Seq=84793 Ack=369 Win=14182 Len=1460",
"Nov 17, 2024 15:23:36.975975000 IST","172.20.10.4","172.20.10.2","c0:35:32:26:48:bb","3c:95:09:f2:ef:17","51480,4444",,"51480 → 4444 [ACK] Seq=369 Ack=86253 Win=2053 Len=0",
"Nov 17, 2024 15:23:36.977574000 IST","172.20.10.2","172.20.10.4","3c:95:09:f2:ef:17","c0:35:32:26:48:bb","4444,51480",,"4444 → 51480 [ACK] Seq=86253 Ack=369 Win=14182 Len=1460",
"Nov 17, 2024 15:23:36.977574000 IST","172.20.10.2","172.20.10.4","3c:95:09:f2:ef:17","c0:35:32:26:48:bb","4444,51480",,"4444 → 51480 [PSH, ACK] Seq=87713 Ack=369 Win=14182 Len=1460",
"Nov 17, 2024 15:23:36.977609000 IST","172.20.10.4","172.20.10.2","c0:35:32:26:48:bb","3c:95:09:f2:ef:17","51480,4444",,"51480 → 4444 [ACK] Seq=369 Ack=89173 Win=2053 Len=0",
"Nov 17, 2024 15:23:36.980658000 IST","172.20.10.2","172.20.10.4","3c:95:09:f2:ef:17","c0:35:32:26:48:bb","4444,51480",,"4444 → 51480 [ACK] Seq=89173 Ack=369 Win=14182 Len=1460",
"Nov 17, 2024 15:23:36.980658000 IST","172.20.10.2","172.20.10.4","3c:95:09:f2:ef:17","c0:35:32:26:48:bb","4444,51480",,"4444 → 51480 [ACK] Seq=90633 Ack=369 Win=14182 Len=1460",
"Nov 17, 2024 15:23:36.980658000 IST","172.20.10.2","172.20.10.4","3c:95:09:f2:ef:17","c0:35:32:26:48:bb","4444,51480",,"4444 → 51480 [PSH, ACK] Seq=92093 Ack=369 Win=14182 Len=1460",
"Nov 17, 2024 15:23:36.980703000 IST","172.20.10.4","172.20.10.2","c0:35:32:26:48:bb","3c:95:09:f2:ef:17","51480,4444",,"51480 → 4444 [ACK] Seq=369 Ack=93553 Win=2053 Len=0",
"Nov 17, 2024 15:23:36.981670000 IST","172.20.10.2","172.20.10.4","3c:95:09:f2:ef:17","c0:35:32:26:48:bb","4444,51480",,"4444 → 51480 [ACK] Seq=93553 Ack=369 Win=14182 Len=1460",
"Nov 17, 2024 15:23:36.981670000 IST","172.20.10.2","172.20.10.4","3c:95:09:f2:ef:17","c0:35:32:26:48:bb","4444,51480",,"4444 → 51480 [ACK] Seq=95013 Ack=369 Win=14182 Len=1460",
"Nov 17, 2024 15:23:36.981670000 IST","172.20.10.2","172.20.10.4","3c:95:09:f2:ef:17","c0:35:32:26:48:bb","4444,51480",,"4444 → 51480 [ACK] Seq=96473 Ack=369 Win=14182 Len=1460",
"Nov 17, 2024 15:23:36.981670000 IST","172.20.10.2","172.20.10.4","3c:95:09:f2:ef:17","c0:35:32:26:48:bb","4444,51480",,"4444 → 51480 [ACK] Seq=97933 Ack=369 Win=14182 Len=1460",
"Nov 17, 2024 15:23:36.981670000 IST","172.20.10.2","172.20.10.4","3c:95:09:f2:ef:17","c0:35:32:26:48:bb","4444,51480",,"4444 → 51480 [ACK] Seq=99393 Ack=369 Win=14182 Len=1460",
"Nov 17, 2024 15:23:36.981670000 IST","172.20.10.2","172.20.10.4","3c:95:09:f2:ef:17","c0:35:32:26:48:bb","4444,51480",,"4444 → 51480 [PSH, ACK] Seq=100853 Ack=369 Win=14182 Len=1460",
"Nov 17, 2024 15:23:36.981705000 IST","172.20.10.4","172.20.10.2","c0:35:32:26:48:bb","3c:95:09:f2:ef:17","51480,4444",,"51480 → 4444 [ACK] Seq=369 Ack=102313 Win=2053 Len=0",
"Nov 17, 2024 15:23:36.987840000 IST","172.20.10.2","172.20.10.4","3c:95:09:f2:ef:17","c0:35:32:26:48:bb","4444,51480",,"4444 → 51480 [ACK] Seq=102313 Ack=369 Win=14182 Len=1460",
"Nov 17, 2024 15:23:36.987840000 IST","172.20.10.2","172.20.10.4","3c:95:09:f2:ef:17","c0:35:32:26:48:bb","4444,51480",,"4444 → 51480 [ACK] Seq=103773 Ack=369 Win=14182 Len=1460",
"Nov 17, 2024 15:23:36.987840000 IST","172.20.10.2","172.20.10.4","3c:95:09:f2:ef:17","c0:35:32:26:48:bb","4444,51480",,"4444 → 51480 [PSH, ACK] Seq=105233 Ack=369 Win=14182 Len=1460",
"Nov 17, 2024 15:23:36.987840000 IST","172.20.10.2","172.20.10.4","3c:95:09:f2:ef:17","c0:35:32:26:48:bb","4444,51480",,"4444 → 51480 [ACK] Seq=106693 Ack=369 Win=14182 Len=1460",
"Nov 17, 2024 15:23:36.987840000 IST","172.20.10.2","172.20.10.4","3c:95:09:f2:ef:17","c0:35:32:26:48:bb","4444,51480",,"4444 → 51480 [ACK] Seq=108153 Ack=369 Win=14182 Len=1460",
"Nov 17, 2024 15:23:36.987895000 IST","172.20.10.4","172.20.10.2","c0:35:32:26:48:bb","3c:95:09:f2:ef:17","51480,4444",,"51480 → 4444 [ACK] Seq=369 Ack=109613 Win=2053 Len=0",
"Nov 17, 2024 15:23:37.008216000 IST","172.20.10.2","172.20.10.4","3c:95:09:f2:ef:17","c0:35:32:26:48:bb","4444,51480",,"4444 → 51480 [ACK] Seq=109613 Ack=369 Win=14182 Len=1460",
"Nov 17, 2024 15:23:37.008216000 IST","172.20.10.2","172.20.10.4","3c:95:09:f2:ef:17","c0:35:32:26:48:bb","4444,51480",,"4444 → 51480 [ACK] Seq=111073 Ack=369 Win=14182 Len=1460",
"Nov 17, 2024 15:23:37.008216000 IST","172.20.10.2","172.20.10.4","3c:95:09:f2:ef:17","c0:35:32:26:48:bb","4444,51480",,"4444 → 51480 [ACK] Seq=112533 Ack=369 Win=14182 Len=1460",
"Nov 17, 2024 15:23:37.008216000 IST","172.20.10.2","172.20.10.4","3c:95:09:f2:ef:17","c0:35:32:26:48:bb","4444,51480",,"4444 → 51480 [ACK] Seq=113993 Ack=369 Win=14182 Len=1460",
"Nov 17, 2024 15:23:37.008216000 IST","172.20.10.2","172.20.10.4","3c:95:09:f2:ef:17","c0:35:32:26:48:bb","4444,51480",,"4444 → 51480 [ACK] Seq=115453 Ack=369 Win=14182 Len=1460",
"Nov 17, 2024 15:23:37.008216000 IST","172.20.10.2","172.20.10.4","3c:95:09:f2:ef:17","c0:35:32:26:48:bb","4444,51480",,"4444 → 51480 [ACK] Seq=116913 Ack=369 Win=14182 Len=1460",
"Nov 17, 2024 15:23:37.008289000 IST","172.20.10.4","172.20.10.2","c0:35:32:26:48:bb","3c:95:09:f2:ef:17","51480,4444",,"51480 → 4444 [ACK] Seq=369 Ack=118373 Win=2053 Len=0",
"Nov 17, 2024 15:23:37.012126000 IST","172.20.10.2","172.20.10.4","3c:95:09:f2:ef:17","c0:35:32:26:48:bb","4444,51480",,"4444 → 51480 [ACK] Seq=118373 Ack=369 Win=14182 Len=1460",
"Nov 17, 2024 15:23:37.012126000 IST","172.20.10.2","172.20.10.4","3c:95:09:f2:ef:17","c0:35:32:26:48:bb","4444,51480",,"4444 → 51480 [ACK] Seq=119833 Ack=369 Win=14182 Len=1460",
"Nov 17, 2024 15:23:37.012126000 IST","172.20.10.2","172.20.10.4","3c:95:09:f2:ef:17","c0:35:32:26:48:bb","4444,51480",,"4444 → 51480 [ACK] Seq=121293 Ack=369 Win=14182 Len=1460",
"Nov 17, 2024 15:23:37.012126000 IST","172.20.10.2","172.20.10.4","3c:95:09:f2:ef:17","c0:35:32:26:48:bb","4444,51480",,"4444 → 51480 [PSH, ACK] Seq=122753 Ack=369 Win=14182 Len=1460",
"Nov 17, 2024 15:23:37.012170000 IST","172.20.10.4","172.20.10.2","c0:35:32:26:48:bb","3c:95:09:f2:ef:17","51480,4444",,"51480 → 4444 [ACK] Seq=369 Ack=124213 Win=2053 Len=0",
"Nov 17, 2024 15:23:37.012455000 IST","151.101.38.172","172.20.10.4","aa:ab:b5:01:10:64","c0:35:32:26:48:bb","80,51749",,"80 → 51749 [ACK] Seq=37801 Ack=1 Win=280 Len=1400",
"Nov 17, 2024 15:23:37.053041000 IST","172.20.10.4","151.101.38.172","c0:35:32:26:48:bb","aa:ab:b5:01:10:64","51749,80",,"51749 → 80 [ACK] Seq=1 Ack=39201 Win=514 Len=0",
"Nov 17, 2024 15:23:37.057678000 IST","172.20.10.2","172.20.10.4","3c:95:09:f2:ef:17","c0:35:32:26:48:bb","4444,51480",,"4444 → 51480 [ACK] Seq=124213 Ack=369 Win=14182 Len=1460",
"Nov 17, 2024 15:23:37.057678000 IST","172.20.10.2","172.20.10.4","3c:95:09:f2:ef:17","c0:35:32:26:48:bb","4444,51480",,"4444 → 51480 [ACK] Seq=125673 Ack=369 Win=14182 Len=1460",
"Nov 17, 2024 15:23:37.057678000 IST","172.20.10.2","172.20.10.4","3c:95:09:f2:ef:17","c0:35:32:26:48:bb","4444,51480",,"4444 → 51480 [ACK] Seq=127133 Ack=369 Win=14182 Len=1460",
"Nov 17, 2024 15:23:37.057678000 IST","172.20.10.2","172.20.10.4","3c:95:09:f2:ef:17","c0:35:32:26:48:bb","4444,51480",,"4444 → 51480 [ACK] Seq=128593 Ack=369 Win=14182 Len=1460",
"Nov 17, 2024 15:23:37.057678000 IST","172.20.10.2","172.20.10.4","3c:95:09:f2:ef:17","c0:35:32:26:48:bb","4444,51480",,"4444 → 51480 [ACK] Seq=130053 Ack=369 Win=14182 Len=1460",
"Nov 17, 2024 15:23:37.057678000 IST","172.20.10.2","172.20.10.4","3c:95:09:f2:ef:17","c0:35:32:26:48:bb","4444,51480",,"4444 → 51480 [ACK] Seq=131513 Ack=369 Win=14182 Len=1460",
"Nov 17, 2024 15:23:37.057678000 IST","172.20.10.2","172.20.10.4","3c:95:09:f2:ef:17","c0:35:32:26:48:bb","4444,51480",,"4444 → 51480 [PSH, ACK] Seq=132973 Ack=369 Win=14182 Len=1460",
"Nov 17, 2024 15:23:37.057678000 IST","172.20.10.2","172.20.10.4","3c:95:09:f2:ef:17","c0:35:32:26:48:bb","4444,51480",,"4444 → 51480 [ACK] Seq=134433 Ack=369 Win=14182 Len=1460",
"Nov 17, 2024 15:23:37.057678000 IST","172.20.10.2","172.20.10.4","3c:95:09:f2:ef:17","c0:35:32:26:48:bb","4444,51480",,"4444 → 51480 [ACK] Seq=135893 Ack=369 Win=14182 Len=1460",
"Nov 17, 2024 15:23:37.057781000 IST","172.20.10.4","172.20.10.2","c0:35:32:26:48:bb","3c:95:09:f2:ef:17","51480,4444",,"51480 → 4444 [ACK] Seq=369 Ack=137353 Win=2053 Len=0",
"Nov 17, 2024 15:23:37.061661000 IST","172.20.10.2","172.20.10.4","3c:95:09:f2:ef:17","c0:35:32:26:48:bb","4444,51480",,"4444 → 51480 [ACK] Seq=137353 Ack=369 Win=14182 Len=1460",
"Nov 17, 2024 15:23:37.061661000 IST","172.20.10.2","172.20.10.4","3c:95:09:f2:ef:17","c0:35:32:26:48:bb","4444,51480",,"4444 → 51480 [ACK] Seq=138813 Ack=369 Win=14182 Len=1460",
"Nov 17, 2024 15:23:37.061661000 IST","172.20.10.2","172.20.10.4","3c:95:09:f2:ef:17","c0:35:32:26:48:bb","4444,51480",,"4444 → 51480 [ACK] Seq=140273 Ack=369 Win=14182 Len=1460",
"Nov 17, 2024 15:23:37.061661000 IST","172.20.10.2","172.20.10.4","3c:95:09:f2:ef:17","c0:35:32:26:48:bb","4444,51480",,"4444 → 51480 [PSH, ACK] Seq=141733 Ack=369 Win=14182 Len=1460",
"Nov 17, 2024 15:23:37.061661000 IST","172.20.10.2","172.20.10.4","3c:95:09:f2:ef:17","c0:35:32:26:48:bb","4444,51480",,"4444 → 51480 [ACK] Seq=143193 Ack=369 Win=14182 Len=1460",
"Nov 17, 2024 15:23:37.061661000 IST","172.20.10.2","172.20.10.4","3c:95:09:f2:ef:17","c0:35:32:26:48:bb","4444,51480",,"4444 → 51480 [ACK] Seq=144653 Ack=369 Win=14182 Len=1460",
"Nov 17, 2024 15:23:37.061661000 IST","172.20.10.2","172.20.10.4","3c:95:09:f2:ef:17","c0:35:32:26:48:bb","4444,51480",,"4444 → 51480 [ACK] Seq=146113 Ack=369 Win=14182 Len=1460",
"Nov 17, 2024 15:23:37.061661000 IST","172.20.10.2","172.20.10.4","3c:95:09:f2:ef:17","c0:35:32:26:48:bb","4444,51480",,"4444 → 51480 [ACK] Seq=147573 Ack=369 Win=14182 Len=1460",
"Nov 17, 2024 15:23:37.061661000 IST","172.20.10.2","172.20.10.4","3c:95:09:f2:ef:17","c0:35:32:26:48:bb","4444,51480",,"4444 → 51480 [ACK] Seq=149033 Ack=369 Win=14182 Len=1460",
"Nov 17, 2024 15:23:37.061661000 IST","172.20.10.2","172.20.10.4","3c:95:09:f2:ef:17","c0:35:32:26:48:bb","4444,51480",,"4444 → 51480 [ACK] Seq=150493 Ack=369 Win=14182 Len=1460",
"Nov 17, 2024 15:23:37.061661000 IST","172.20.10.2","172.20.10.4","3c:95:09:f2:ef:17","c0:35:32:26:48:bb","4444,51480",,"4444 → 51480 [ACK] Seq=151953 Ack=369 Win=14182 Len=1460",
"Nov 17, 2024 15:23:37.061661000 IST","172.20.10.2","172.20.10.4","3c:95:09:f2:ef:17","c0:35:32:26:48:bb","4444,51480",,"4444 → 51480 [ACK] Seq=153413 Ack=369 Win=14182 Len=1460",
"Nov 17, 2024 15:23:37.061661000 IST","172.20.10.2","172.20.10.4","3c:95:09:f2:ef:17","c0:35:32:26:48:bb","4444,51480",,"4444 → 51480 [ACK] Seq=154873 Ack=369 Win=14182 Len=1460",
"Nov 17, 2024 15:23:37.061661000 IST","172.20.10.2","172.20.10.4","3c:95:09:f2:ef:17","c0:35:32:26:48:bb","4444,51480",,"4444 → 51480 [ACK] Seq=156333 Ack=369 Win=14182 Len=1460",
"Nov 17, 2024 15:23:37.061661000 IST","172.20.10.2","172.20.10.4","3c:95:09:f2:ef:17","c0:35:32:26:48:bb","4444,51480",,"4444 → 51480 [ACK] Seq=157793 Ack=369 Win=14182 Len=1460",
"Nov 17, 2024 15:23:37.061661000 IST","172.20.10.2","172.20.10.4","3c:95:09:f2:ef:17","c0:35:32:26:48:bb","4444,51480",,"4444 → 51480 [ACK] Seq=159253 Ack=369 Win=14182 Len=1460",
"Nov 17, 2024 15:23:37.061661000 IST","172.20.10.2","172.20.10.4","3c:95:09:f2:ef:17","c0:35:32:26:48:bb","4444,51480",,"4444 → 51480 [ACK] Seq=160713 Ack=369 Win=14182 Len=1460",
"Nov 17, 2024 15:23:37.061661000 IST","172.20.10.2","172.20.10.4","3c:95:09:f2:ef:17","c0:35:32:26:48:bb","4444,51480",,"4444 → 51480 [ACK] Seq=162173 Ack=369 Win=14182 Len=1460",
